channel,video_id,title,published_date,published,url,view_count,duration_seconds
rSpace,dHUbbBbs3tA,"Coworker Gave My Wife a Car As a Gift, I Knew Something Was Fishy",2026-02-23,Feb 23,https://youtube.com/watch?v=dHUbbBbs3tA,12602,0
Charlotte Dobre,KAFOWqSX9cE,I Exposed My Coworker… and It Ruined Her Career - Charlotte Dobre REACTION,2026-02-21,Feb 21,https://youtube.com/watch?v=KAFOWqSX9cE,686374,0
rSpace,EUtw0AMFNEg,"Wife Cheated Because She Said I Was Too Nice; So I Ruined Her Life, and Now She Wants Me Back",2026-02-21,Feb 21,https://youtube.com/watch?v=EUtw0AMFNEg,14976,0
Reddit On Wiki,zQzjiQQZjBw,My Boyfriend SMASHED a “ME” Shaped Piñata at a Secret Frat Party...AITA?,2026-02-20,Feb 20,https://youtube.com/watch?v=zQzjiQQZjBw,15924,0
rSpace,ToRVI8uvLOI,Viral TikTok Revealed My Wife’s Secret Affair While She Was Overseas,2026-02-20,Feb 20,https://youtube.com/watch?v=ToRVI8uvLOI,13319,0
Two Hot Takes,SyMtZj8crxw,That's Suspicious! Ft. Taylor Tomlinson || Reddit Stories || Two Hot Takes Podcast,2026-02-19,Feb 19,https://youtube.com/watch?v=SyMtZj8crxw,474828,0
rSpace,Vd5flk72cH0,"Caught My Girlfriend Cheating—Her AP and His Boys Jumped Me, Now He’s Facing Jail and She’s Exposed",2026-02-17,Feb 17,https://youtube.com/watch?v=Vd5flk72cH0,12506,0
Charlotte Dobre,ckb6w92V2Yg,my best friend doesn't want me at her wedding - Charlotte Dobre REACTION,2026-02-16,Feb 16,https://youtube.com/watch?v=ckb6w92V2Yg,625375,0
Mr. Redder,6paqAhIhzBs,My Best Friend CATFISHED My Wife and DESTROYED Our Marriage | Entitled Family Stories,2026-02-16,Feb 16,https://youtube.com/watch?v=6paqAhIhzBs,16937,0
rSpace,P9sIp8PmkrM,My Wife Said That Cheating on Me Was Doing Me a Favor; I Got Her Fired,2026-02-15,Feb 15,https://youtube.com/watch?v=P9sIp8PmkrM,12919,0
Two Hot Takes,AShyP4vFGBU,Ludicrous! Ft. Angela Giarratana || Reddit Stories || Two Hot Takes Podcast,2026-02-13,Feb 13,https://youtube.com/watch?v=AShyP4vFGBU,631923,0
Charlotte Dobre,nUQr3f4Mm7Y,bridezillas have lost their dang MINDS - Charlotte Dobre REACTION,2026-02-11,Feb 11,https://youtube.com/watch?v=nUQr3f4Mm7Y,741375,0
Mr. Redder,a2_xRmfAoeY,My Husband’s Daughter EXPOSED My Past… BIG MISTAKE! | Entitled Family Stories,2026-02-09,Feb 09,https://youtube.com/watch?v=a2_xRmfAoeY,17042,0
Two Hot Takes,88HwehaVA3s,MORE Updates.. || Reddit Stories || Two Hot Takes Podcast,2026-02-05,Feb 05,https://youtube.com/watch?v=88HwehaVA3s,370735,0
Mr. Redder,6eDz1ia-PPc,My Wife Became Obsessed With Her Male Coworker… AITA? | Entitled Family Stories,2026-02-02,Feb 02,https://youtube.com/watch?v=6eDz1ia-PPc,17519,0
Karma Stories,qctrVrxz7FA,"r/ProRevenge - My Agent Stole MILLION$ From Me, Now He's Rotting In A CELL! 🤬",2026-01-30,Jan 30,https://youtube.com/watch?v=qctrVrxz7FA,11710,0
Two Hot Takes,j-9mruk3h18,Happy Updates Only.. || Reddit Stories || Two Hot Takes Podcast,2026-01-29,Jan 29,https://youtube.com/watch?v=j-9mruk3h18,292795,0
Karma Stories,FqEegQc2PVs,"r/MaliciousCompliance - New BOSS Cut My Bonus, I Left Him DROWNING In Work! 😈",2026-01-28,Jan 28,https://youtube.com/watch?v=FqEegQc2PVs,18238,0
Karma Stories,Bj2pdGbWAlw,r/OffMyChest - He CHEATED So I Deleted His Career!,2026-01-27,Jan 27,https://youtube.com/watch?v=Bj2pdGbWAlw,5891,0
Mr. Redder,7FDtv4vl00s,My Husband's Mom Made Fake AI Photos of Me… BIG MISTAKE! | Entitled Family Stories,2026-01-25,Jan 25,https://youtube.com/watch?v=7FDtv4vl00s,27406,0
Karma Stories,GbGgMDfiOT4,"r/MaliciousCompliance - He Called Me a B***H, So I Exposed His SCAM!",2026-01-22,Jan 22,https://youtube.com/watch?v=GbGgMDfiOT4,8609,0
Mr. Redder,Oo-mq8UMnvg,My Boyfriend Threatened to Break Up Over My Tattoo… HUGE MISTAKE! | Entitled Family Stories,2026-01-19,Jan 19,https://youtube.com/watch?v=Oo-mq8UMnvg,18614,0
Karma Stories,mdBfj--cfow,"r/MaliciousCompliance - BOSS Rejected My Expenses, So I TRIPLED Them! 💰",2026-01-19,Jan 19,https://youtube.com/watch?v=mdBfj--cfow,11148,0
Mr. Redder,qWHtgFy4uRA,My Wife’s Parents Made Me Sign A Prenup… HUGE MISTAKE! | Entitled Family Stories,2026-01-12,Jan 12,https://youtube.com/watch?v=qWHtgFy4uRA,17225,0
Karma Stories,LKciZSjiQXE,"r/MaliciousCompliance - He TRAPPED Me At Work, So I EXPOSED Him To His Boss! 😈",2026-01-12,Jan 12,https://youtube.com/watch?v=LKciZSjiQXE,11234,0
Karma Stories,DJ1vbVzKrn0,"r/ProRevenge - He Made Me MISERABLE, So I Made His WORST DREAMS Come True!",2026-01-08,Jan 08,https://youtube.com/watch?v=DJ1vbVzKrn0,12052,0
Mr. Redder,ktsg_zx5Mo8,My Fiancée's Family IS STALKING ME... AITA? | Entitled Family Stories,2026-01-05,Jan 05,https://youtube.com/watch?v=ktsg_zx5Mo8,19175,0
Karma Stories,WIjyXXUQdYk,"r/MaliciousCompliance - I Told The Customer Her Car Would Break, She Said PROVE IT! 😈",2026-01-05,Jan 05,https://youtube.com/watch?v=WIjyXXUQdYk,17556,0
Mr. Redder,ZFtgRfGcVss,My Wife's Sister CONFESSES HER LOVE TO ME... AITA? | Entitled Family Stories,2025-12-29,Dec 29,https://youtube.com/watch?v=ZFtgRfGcVss,18457,0
Mr. Redder,ONvKVQFMYp4,My Wife’s Mom DEMANDS I Stop Using AI… HUGE MISTAKE! | Entitled Family Stories,2025-12-22,Dec 22,https://youtube.com/watch?v=ONvKVQFMYp4,16303,0
Mr. Redder,D_KYzrrSM0M,My Girlfriend of 8 Years REFUSES to Marry Me... AITA? | Entitled Family Stories,2025-12-18,Dec 18,https://youtube.com/watch?v=D_KYzrrSM0M,16481,0
Mr. Redder,ktW1xHlr3BA,My Entitled Mom DEMANDS I Babysit My Sister... AITA? | Entitled Family Stories,2025-12-15,Dec 15,https://youtube.com/watch?v=ktW1xHlr3BA,17176,0
Mr. Redder,9iR2Bsmpu70,My Husband's 'Work Wife' is DESTROYING Our Marriage | Entitled Family Stories,2025-12-11,Dec 11,https://youtube.com/watch?v=9iR2Bsmpu70,23771,0
