channel,video_id,title,published_date,published,url,view_count,duration_seconds
rSlash,dbgkN1JcwzQ,r/AITA for Thinking My Friend is a Predator?,2026-03-16,Mar 16,https://youtube.com/watch?v=dbgkN1JcwzQ,54884,0
MrBallen,eztyXnafF8I,Florida family terrorized by a masked intruder,2026-03-16,Mar 16,https://youtube.com/watch?v=eztyXnafF8I,65093,0
Am I the Jerk,HsucAZ5K-6c,"Psycho-Mom CALLS MY COLLEGE demanding they CHANGE MY MAJOR, saying I'm ""CRAZY"" - Reddit Podcast",2026-03-16,Mar 16,https://youtube.com/watch?v=HsucAZ5K-6c,802,0
Mark Narrations,nWPuqf8zpQA,My Brother SOLD HIS INHERITANCE And Now Wants Half Of Mine | r/BestOf,2026-03-16,Mar 16,https://youtube.com/watch?v=nWPuqf8zpQA,10615,0
Reddit On Wiki,Jw4Feg0JzHg,I TESTED My Boyfriend And He BROKE UP With Me! | Reading Reddit Stories,2026-03-16,Mar 16,https://youtube.com/watch?v=Jw4Feg0JzHg,2298,0
Karma Stories,igQnAWmsnhc,r/MaliciousCompliance - Accused of THEFT? I Made Them RETRACT With One Move!,2026-03-16,Mar 16,https://youtube.com/watch?v=igQnAWmsnhc,2050,0
rSpace,Rt7Cfu1Ai0U,Found Out My Newborn Wasn’t Mine Because His Real Father Showed Up; I Ditched My Wife in Humiliating,2026-03-16,Mar 16,https://youtube.com/watch?v=Rt7Cfu1Ai0U,8923,0
Lost Genre,j3vER_njNT4,"Bride Approved My Dress, Then Demanded I Change It Because It “Didn’t Fit the Vibe” - Reddir Stories",2026-03-16,Mar 16,https://youtube.com/watch?v=j3vER_njNT4,5276,0
Ripe Stories,DdMDUv2DPh4,"HOA Karen Sprayed My Service Dog, Acts Shocked When COPS Said It's A Federal Crime!",2026-03-16,Mar 16,https://youtube.com/watch?v=DdMDUv2DPh4,2546,0
rSlash,7ped_46RZgk,"r/TIFU by Trying to ""Netflix and Chill"" my Students",2026-03-15,Mar 15,https://youtube.com/watch?v=7ped_46RZgk,77380,0
Am I the Jerk,kSxF1OYKUxA,Psycho Cousin STEALS my CREDIT CARD to RESERVE HER VACATION - Reddit Podcast,2026-03-15,Mar 15,https://youtube.com/watch?v=kSxF1OYKUxA,3903,0
Mark Narrations,C4fpcefhNYc,My Boyfriend Got Married But NOT To Me - Am I An Idiot For Staying? | r/BestOf,2026-03-15,Mar 15,https://youtube.com/watch?v=C4fpcefhNYc,36789,0
Updoot Studios,HL4KS52BIn0,What Would Your Company NEVER Tell It's Customers?,2026-03-15,Mar 15,https://youtube.com/watch?v=HL4KS52BIn0,3998,0
Karma Stories,uBM6PxGSbbA,"r/IDontWorkHereLady - She ASSUMED I Was Staff, I Gave Her The Surprise Of A LIFETIME!",2026-03-15,Mar 15,https://youtube.com/watch?v=uBM6PxGSbbA,2726,0
rSpace,ROdLzSnnkSA,"Tracked My Wife’s Affair for Weeks, Caught Her at His House, and She Left Town After the Divorce",2026-03-15,Mar 15,https://youtube.com/watch?v=ROdLzSnnkSA,9826,0
Ripe Stories,k2bbO3ViNB0,"r/MaliciousCompliance Boss DEMANDS I Violate Safety Procedures.. Loses $24,000,000!",2026-03-15,Mar 15,https://youtube.com/watch?v=k2bbO3ViNB0,18411,0
Lost Genre,mX2jtvjwEYo,"My Girlfriend Told Me She Has Cancer—Then Admitted She Cheated, So I Dumped Her - Reddit Stories",2026-03-15,Mar 15,https://youtube.com/watch?v=mX2jtvjwEYo,20895,0
rSlash,xQWRCVTxqoE,"r/Offmychest I Flew 7,000 km to Date a Webcam Model",2026-03-14,Mar 14,https://youtube.com/watch?v=xQWRCVTxqoE,96825,0
MrBallen,znAFjWDHXd0,This soldier fought in the trenches for 30 years...,2026-03-14,Mar 14,https://youtube.com/watch?v=znAFjWDHXd0,409320,0
Comfort Level,OjeCTNnj3Ho,Boyfriend got really jacked and now I’m no longer attracted to him💔+ MORE STORIES ⏰ (Reddit Stories),2026-03-14,Mar 14,https://youtube.com/watch?v=OjeCTNnj3Ho,9727,0
Am I the Jerk,PQn9kf47O5U,Entitled Art-Teacher STEALS MY ART WORK and POSTS IT ONLINE  - Reddit Podcast,2026-03-14,Mar 14,https://youtube.com/watch?v=PQn9kf47O5U,3693,0
Mark Narrations,AXm6-nGfQZk,WIBTA For Committing To A University Faraway Even Though My Mother Is Sick | r/BestOf,2026-03-14,Mar 14,https://youtube.com/watch?v=AXm6-nGfQZk,29422,0
Mark Narrations,fINRBaogRBA,My Boyfriend's 10-Year Secret Ended Our 4 Year Relationship And He Thinks I'm The Problem | Reddit,2026-03-14,Mar 14,https://youtube.com/watch?v=fINRBaogRBA,33263,0
Updoot Studios,VCmjGcqVRQc,"Parents, What Shocking Things Has Your Kid's SO Done?",2026-03-14,Mar 14,https://youtube.com/watch?v=VCmjGcqVRQc,1988,0
Karma Stories,tU-0wU1ctHw,"r/BestOfReddit - He Snapped Roxy, So I SNAPPED His Marriage!",2026-03-14,Mar 14,https://youtube.com/watch?v=tU-0wU1ctHw,2512,0
rSpace,RbiU4m9w2no,I Exposed My Girlfriend’s Affair — She Tried to Frame Me and Went to Jail Instead,2026-03-14,Mar 14,https://youtube.com/watch?v=RbiU4m9w2no,7632,0
Ripe Stories,QvoxzQ24kbA,"HOA Called Police On Me For Wheelchair On My Patio.. I Sued Them For $150,000!",2026-03-14,Mar 14,https://youtube.com/watch?v=QvoxzQ24kbA,22248,0
Lost Genre,6BPVgEqjC-0,My Freeloader Boyfriend Wants To Be A YouTuber And I Regret Saying Yes - Reddit Stories,2026-03-14,Mar 14,https://youtube.com/watch?v=6BPVgEqjC-0,15615,0
rSpace,c7CldFrFWnY,"I Caught My Wife Cheating With My Cousin — Exposed Them, and Ruined Their Lives",2026-03-13,Mar 13,https://youtube.com/watch?v=c7CldFrFWnY,9184,0
rSlash,szIbo7nYdSc,r/Bestof I Kidnapped My Own Sister,2026-03-13,Mar 13,https://youtube.com/watch?v=szIbo7nYdSc,111533,0
MrBallen,7KBuX6F9868,Top 5 Bingeable SCARY STORIES • PLACES You Can't Go Edition Vol. 3,2026-03-13,Mar 13,https://youtube.com/watch?v=7KBuX6F9868,605926,0
Charlotte Dobre,mnJyC7d0LJ8,Sister in Law Planned Her Baby Shower on the SAME Day as My Wedding - Charlotte Dobre REACTION,2026-03-13,Mar 13,https://youtube.com/watch?v=mnJyC7d0LJ8,492006,0
Mark Narrations,du-6f7o-u2I,"Entitled Bully Co-Worker Says I'm Going To ""Find Out"" And It Backfires | r/EntitledPeople",2026-03-13,Mar 13,https://youtube.com/watch?v=du-6f7o-u2I,43977,0
Mark Narrations,jRItDlMIWSY,Sister UNINVITED ME To Her Wedding So I Told My Parents Not TO Go | r/BestOf,2026-03-13,Mar 13,https://youtube.com/watch?v=jRItDlMIWSY,34920,0
Reddit On Wiki,rFsvOc5Estg,I Called A Kid A BRAT During A Sleepover... AITA?,2026-03-13,Mar 13,https://youtube.com/watch?v=rFsvOc5Estg,11394,0
Updoot Studios,m2WAE2VMjy8,"Parents, Do You Regret the Names You Gave Your Children?",2026-03-13,Mar 13,https://youtube.com/watch?v=m2WAE2VMjy8,4024,0
Karma Stories,4d7afW1iiKs,r/MaliciousCompliance - 2 Hours of Perfect Payback - March 2026 Malicious Compliance Compilation,2026-03-13,Mar 13,https://youtube.com/watch?v=4d7afW1iiKs,2468,0
Karma Stories,kkeXkGg-FuI,"r/EntitledParents - They DEMANDED A Reward, So I Gave Them A REALITY Check!",2026-03-13,Mar 13,https://youtube.com/watch?v=kkeXkGg-FuI,3686,0
Ripe Stories,QNU7z4OLeyM,r/MaliciousCompliance Karen Boss Fires “nicest old guy”.. within weeks everything falls apart!,2026-03-13,Mar 13,https://youtube.com/watch?v=QNU7z4OLeyM,20086,0
Lost Genre,gv37-k0WFv8,My Husband’s Family Was Hell Bent on Controlling Us… So I Called the Police On Them,2026-03-13,Mar 13,https://youtube.com/watch?v=gv37-k0WFv8,25478,0
Two Hot Takes,pEJ47uZskgk,A Rare Breed.. || Unique Reddit Stories || Two Hot Takes Podcast,2026-03-12,Mar 12,https://youtube.com/watch?v=pEJ47uZskgk,226011,0
rSlash,0CvINU5iIDI,r/AITA if I Sue My Friend for Not Attending my Wedding,2026-03-12,Mar 12,https://youtube.com/watch?v=0CvINU5iIDI,112902,0
Am I the Jerk,HpbyPV6gDkI,Toxic Bully make my life a NIGHTMARE... so I stole her NINTENTO 3DS as REVENGE - Reddit Podcast,2026-03-12,Mar 12,https://youtube.com/watch?v=HpbyPV6gDkI,1168,0
Mark Narrations,jSY6MEyG_Eg,I GHOST My Entire Family After The Ultimate Betrayal - Now They Want Back In | r/BestOf,2026-03-12,Mar 12,https://youtube.com/watch?v=jSY6MEyG_Eg,59248,0
Mark Narrations,oHQ60AoCLDY,He Filed for Divorce When I Got Cancer… Then My Treatment Worked r/BestOf,2026-03-12,Mar 12,https://youtube.com/watch?v=oHQ60AoCLDY,41012,0
Updoot Studios,jKOd6PxKH88,Funniest Things Parents Said To Their Kindergarten Teacher,2026-03-12,Mar 12,https://youtube.com/watch?v=jKOd6PxKH88,2823,0
Karma Stories,ph4CSi995LE,"r/MaliciousCompliance - You Deny My Expenses, I'll TRIPLE My Costs!",2026-03-12,Mar 12,https://youtube.com/watch?v=ph4CSi995LE,5058,0
rSpace,RzbFw74gqcA,My Girlfriend Made a Fool of Herself in a Celebrity’s DMs; I Exposed and Dumped Her,2026-03-12,Mar 12,https://youtube.com/watch?v=RzbFw74gqcA,8908,0
Ripe Stories,SheeqptP0rQ,They Stole My Driveway - So I Showed Them Why You NEVER Mess With Farmers!,2026-03-12,Mar 12,https://youtube.com/watch?v=SheeqptP0rQ,20650,0
Lost Genre,f-DCg7RT-MM,"My Brother Sold His Inherited Land, Lost Everything… Now He Demands Half of Mine",2026-03-12,Mar 12,https://youtube.com/watch?v=f-DCg7RT-MM,24260,0
rSlash,SsQeJsLzz-k,r/Relationships Girlfriend Stole My Money to Buy a Purse,2026-03-11,Mar 11,https://youtube.com/watch?v=SsQeJsLzz-k,106070,0
MrBallen,o_a5cELQUnQ,His song will KILL you...,2026-03-11,Mar 11,https://youtube.com/watch?v=o_a5cELQUnQ,753951,0
Am I the Jerk,kHSfx0MXPAM,Toxic Manager WRITES ME UP for stopping a CUSTOMER from GETTING SCAMMED - Reddit podcast,2026-03-11,Mar 11,https://youtube.com/watch?v=kHSfx0MXPAM,3545,0
Mark Narrations,D0Ioaarpj7c,I BANNED My Dads Wife From My Daughters Birthday Party Due To Her Behaviour | r/BestOf,2026-03-11,Mar 11,https://youtube.com/watch?v=D0Ioaarpj7c,43474,0
Updoot Studios,ZZEcMtesiOY,What's The Worst Case Of Spoiled Rotten Kids That You've Seen?,2026-03-11,Mar 11,https://youtube.com/watch?v=ZZEcMtesiOY,4554,0
Ripe Stories,0DoI1tdy0uE,"HOA Karen’s Son Stole My ATV, Thinking He’s Untouchable.. Unaware I’m Police!  r/r/OhNoConsequences",2026-03-11,Mar 11,https://youtube.com/watch?v=0DoI1tdy0uE,35481,0
Lost Genre,iXSat1Mre7Q,I Cancelled My Daughter’s Sleepover Because Her Friend’s Stepdad Hit On Me - Reddit Stories,2026-03-11,Mar 11,https://youtube.com/watch?v=iXSat1Mre7Q,26193,0
rSlash,HlG11ov2cnk,r/Pettyrevenge I Got Back at a Thief,2026-03-10,Mar 10,https://youtube.com/watch?v=HlG11ov2cnk,107370,0
Comfort Level,SZ5cIGRG4Yk,35-Year Diagnosis Revealed at Dinner🍽️ + Lost 'Pills'💊—Now I'm Just a 'Mom' (Reddit Stories) Ep. 226,2026-03-10,Mar 10,https://youtube.com/watch?v=SZ5cIGRG4Yk,44135,0
Am I the Jerk,IIKrR-WzPww,Entitled Mother RUINS MY BIRTHDAY on purpose... AGAIN - Reddit Podcast,2026-03-10,Mar 10,https://youtube.com/watch?v=IIKrR-WzPww,3680,0
Mark Narrations,fznnbNiFq0c,My Wife Wants Another Child But It HAS To Be A Girl | r/BestOf,2026-03-10,Mar 10,https://youtube.com/watch?v=fznnbNiFq0c,45322,0
Mark Narrations,d9lbLHw-VEA,Wife Is Weirdly OBSESSIVE About Her Brothers Girlfriend And He Went No Contact | r/BestOf,2026-03-10,Mar 10,https://youtube.com/watch?v=d9lbLHw-VEA,55268,0
Mr. Redder,0Qk2yi4ur5o,My Husband's Mom Lost $50k In Crypto Scam... DEMANDS WE PAY! | Entitled Family Stories,2026-03-10,Mar 10,https://youtube.com/watch?v=0Qk2yi4ur5o,11206,0
Updoot Studios,hCH2Wr5Ptx0,What's The Best Unexplained Mystery?,2026-03-10,Mar 10,https://youtube.com/watch?v=hCH2Wr5Ptx0,5534,0
Karma Stories,Kn9BGb1lvzM,From War to Love - My Grandfather's Memoirs - Part 1,2026-03-10,Mar 10,https://youtube.com/watch?v=Kn9BGb1lvzM,1021,0
rSpace,QBQH3XZpsgU,Wife Ordered Her AP to Attack Me for the Video — He Exposed Her and Helped Me Keep My Son,2026-03-10,Mar 10,https://youtube.com/watch?v=QBQH3XZpsgU,14271,0
Ripe Stories,VxTGl6laeyw,Golden Child Sister Calls COPS Cuz I Refused To Give Her My House!,2026-03-10,Mar 10,https://youtube.com/watch?v=VxTGl6laeyw,24800,0
Lost Genre,ZmWu4EiPP1E,My Boyfriend Hid an STD From Me for 4 Years… Then Said I Was the Problem - REDDIT STORIES,2026-03-10,Mar 10,https://youtube.com/watch?v=ZmWu4EiPP1E,18258,0
rSlash,B8uvPIOAGHw,r/Offmychest I'm Catfish Dating My Own Father,2026-03-09,Mar 09,https://youtube.com/watch?v=B8uvPIOAGHw,103112,0
MrBallen,HZjesdJbfeM,Cali beachfront restaurant held the key to her murder,2026-03-09,Mar 09,https://youtube.com/watch?v=HZjesdJbfeM,836378,0
Mark Narrations,BplQQ5q2hSw,"Girlfriend Said She's ""LOSING RESPECT FOR ME"" For Eating Crackers Late! | r/AmITheDevil",2026-03-09,Mar 09,https://youtube.com/watch?v=BplQQ5q2hSw,36160,0
Mark Narrations,0aQ5311Vttk,AITA For Ratting On My Mother-In-Law Cause A MASSIVE Family Fight | r/BestOf,2026-03-09,Mar 09,https://youtube.com/watch?v=0aQ5311Vttk,42731,0
Reddit On Wiki,DMQxJZeySps,My Boyfriend BROKE UP With Me Because I'm TOO GOOD In Bed? | Reading Reddit Stories,2026-03-09,Mar 09,https://youtube.com/watch?v=DMQxJZeySps,14093,0
Updoot Studios,7IPfydsFSw4,What Was It Like Being In a Coma?,2026-03-09,Mar 09,https://youtube.com/watch?v=7IPfydsFSw4,3982,0
Ripe Stories,fOGYPzN-r-U,"HOA Fined Me For Fishing & My Boat, Unaware I own the Land! I Banned Their Lake Access!",2026-03-09,Mar 09,https://youtube.com/watch?v=fOGYPzN-r-U,41220,0
Lost Genre,43mieAPNA00,Brother Is Angry I Refuse to Pick Up the Pieces After His Ex Breaks His Heart Again,2026-03-09,Mar 09,https://youtube.com/watch?v=43mieAPNA00,25850,0
rSlash,ZQ_m-LT9ngw,r/Bestof Boyfriend Keeps Joking about Murdering Me,2026-03-08,Mar 08,https://youtube.com/watch?v=ZQ_m-LT9ngw,122847,0
Charlotte Dobre,8Gnk6e9oxgc,Boyfriend leaves me for my childhood best friend...and the karma is sweet - Charlotte Dobre REACTION,2026-03-08,Mar 08,https://youtube.com/watch?v=8Gnk6e9oxgc,678505,0
Mark Narrations,8-3nDBauWRE,My Prankster Boyfriend Spent 3 Months Catfishing My Friend And Called ME The Problem | r/BestOf,2026-03-08,Mar 08,https://youtube.com/watch?v=8-3nDBauWRE,41887,0
Updoot Studios,nDVexqCOklI,What Is The Creepiest Glitch In The Matrix You've Experienced?,2026-03-08,Mar 08,https://youtube.com/watch?v=nDVexqCOklI,6394,0
Ripe Stories,cMtcXRNNpXk,"Soldier Came Back Years Later - Family Stole His Property, Sold His House!",2026-03-08,Mar 08,https://youtube.com/watch?v=cMtcXRNNpXk,29732,0
Lost Genre,mPUNh7DsM5I,My Husband Says I Humilated Him By Making Him Parent Our Child Alone One Day,2026-03-08,Mar 08,https://youtube.com/watch?v=mPUNh7DsM5I,28184,0
rSlash,fQ-_UggBeew,r/AITA I Think Her Stepdad is a Pe*o,2026-03-07,Mar 07,https://youtube.com/watch?v=fQ-_UggBeew,121649,0
MrBallen,1RdL8hRX57c,These hauntings were completely real,2026-03-07,Mar 07,https://youtube.com/watch?v=1RdL8hRX57c,1044482,0
Mark Narrations,deCURp2pbQc,The WHOLE Family Was Invited Except My Daughter - Daughter Responds In Reddit| r/BestOf,2026-03-07,Mar 07,https://youtube.com/watch?v=deCURp2pbQc,51599,0
Mark Narrations,AB3sSI2T5_Q,I Blocked My Boyfriend The Night Before Valentines Day After What He Said! | r/BestOf,2026-03-07,Mar 07,https://youtube.com/watch?v=AB3sSI2T5_Q,44523,0
Updoot Studios,uBv_EATfvYQ,What Happened To The Outcast From School?,2026-03-07,Mar 07,https://youtube.com/watch?v=uBv_EATfvYQ,6083,0
Karma Stories,NI8xTzRjqGc,"r/MaliciousCompliance - He Ignored My Advice, Then Ate A $2500 Fine!",2026-03-07,Mar 07,https://youtube.com/watch?v=NI8xTzRjqGc,6210,0
Ripe Stories,KWc3NoAOhiI,Neighbor Used Semitruck to Destroy My Barn! Claims My Farm is ILLEGAL!,2026-03-07,Mar 07,https://youtube.com/watch?v=KWc3NoAOhiI,23971,0
Lost Genre,nzmf25bLenQ,Half Sister Wants a Relationship After She and Her Mom Made My Life Hell - Reddit Stories,2026-03-07,Mar 07,https://youtube.com/watch?v=nzmf25bLenQ,35222,0
Two Hot Takes,XDSYi64GUDs,From the Vault.. || Reddit Stories || Two Hot Takes Podcast,2026-03-06,Mar 06,https://youtube.com/watch?v=XDSYi64GUDs,298731,0
rSlash,ESDnWQ4dHbk,r/Relationships Everyone Hates Me Because of Warhammer 40k,2026-03-06,Mar 06,https://youtube.com/watch?v=ESDnWQ4dHbk,117011,0
MrBallen,sTJNEcyMTsU,Party boy made his FINAL CALLS at 3am,2026-03-06,Mar 06,https://youtube.com/watch?v=sTJNEcyMTsU,1121618,0
Mark Narrations,Gpcr8ULK4x0,Husband's Mistress Hunted Me Down Across Every Platform...So I Gave Her The Truth | r/BestOf,2026-03-06,Mar 06,https://youtube.com/watch?v=Gpcr8ULK4x0,41102,0
Mark Narrations,2bZD6dSoBGw,AITA For Telling My Husband He's DONE Mourning His Best Friend After Two Days | r/OhNoConsequences,2026-03-06,Mar 06,https://youtube.com/watch?v=2bZD6dSoBGw,57747,0
Reddit On Wiki,BwYQ0MfQTUc,I EXPECT My Sister To PLAN My Wedding For FREE... AITA?,2026-03-06,Mar 06,https://youtube.com/watch?v=BwYQ0MfQTUc,14193,0
Updoot Studios,VymIoHxK5yY,"Hiring Managers, Has a Reference Ever Cost Someone a Job?",2026-03-06,Mar 06,https://youtube.com/watch?v=VymIoHxK5yY,13112,0
rSpace,b9L3vd5ht64,Wife Slept With Her Best Friend’s Boyfriend Out of Spite; I Divorced Her and Her,2026-03-06,Mar 06,https://youtube.com/watch?v=b9L3vd5ht64,14696,0
Ripe Stories,cnOulKTLvY8,HOA Karen Orders Tow on Disabled Veteran.. ADA Is NOT Amused! He is NO HOA Member!,2026-03-06,Mar 06,https://youtube.com/watch?v=cnOulKTLvY8,24051,0
Lost Genre,1fmQqmzqrmE,Boyfriend Mocked My OCD and Triggered It on Purpose…Now He's Sorry I Dumped Him,2026-03-06,Mar 06,https://youtube.com/watch?v=1fmQqmzqrmE,25568,0
rSlash,NTNhIv9sV80,r/TIFU by Accidentally Getting Kidnapped,2026-03-05,Mar 05,https://youtube.com/watch?v=NTNhIv9sV80,102102,0
Mark Narrations,nFhGnrkQaGM,I Cut Off My Sister Financially Due To Her FREELOADING Boyfriend Who She Kept SECRET | r/BestOf,2026-03-05,Mar 05,https://youtube.com/watch?v=nFhGnrkQaGM,37179,0
Mark Narrations,XFZ-5vX0Lwc,Co-Worker EXPLODED When I Told I Don't Live With My Girlfriend Of 3 Years | r/AmIWrong,2026-03-05,Mar 05,https://youtube.com/watch?v=XFZ-5vX0Lwc,43215,0
Reddit On Wiki,MldNP1ONRmo,Reddit On Wiki Plays Left 4 Dead 2 Live!,2026-03-05,Mar 05,https://youtube.com/watch?v=MldNP1ONRmo,993,0
Updoot Studios,DgIo07Zglgc,"Whats Your ""You Messed With The Wrong Person"" Story?",2026-03-05,Mar 05,https://youtube.com/watch?v=DgIo07Zglgc,9458,0
Karma Stories,-nI6IdhnaXo,r/TalesFromTechSupport - Switch The Monitors They Said... It'll Be Quick They Said...,2026-03-05,Mar 05,https://youtube.com/watch?v=-nI6IdhnaXo,3737,0
Ripe Stories,nKzMx6BR3_o,"Boss FIRED Me, Takes Credit For MY WORK to Get Promotion.. Forgot I Own The Software!",2026-03-05,Mar 05,https://youtube.com/watch?v=nKzMx6BR3_o,30524,0
Lost Genre,ubMd6bCIsXc,My Husband’s Mistress Called Me to Flex…I One Upped Her And My Reply Made Her Lose It,2026-03-05,Mar 05,https://youtube.com/watch?v=ubMd6bCIsXc,38880,0
rSlash,Zr9GdxDm8Iw,r/Offmychest I Blew All My Savings on Get Rich Quick,2026-03-04,Mar 04,https://youtube.com/watch?v=Zr9GdxDm8Iw,127735,0
MrBallen,lDd-FAqesgM,He stood up to the government and became a LEGEND,2026-03-04,Mar 04,https://youtube.com/watch?v=lDd-FAqesgM,866766,0
Mark Narrations,yNeNl2MEOqc,Bride Puts ALL OF HER EXES At One Table - Then EXPOSED Me In Front Of Everyone | r/BestOf,2026-03-04,Mar 04,https://youtube.com/watch?v=yNeNl2MEOqc,51817,0
Reddit On Wiki,73D7XXGkj1o,I CAUSED A Scene At My Boyfriend's Work... AITA? | Wednesday Live Show,2026-03-04,Mar 04,https://youtube.com/watch?v=73D7XXGkj1o,12969,0
Updoot Studios,hJrbKaL_eH4,What's the Greatest Movie Theory Ever?,2026-03-04,Mar 04,https://youtube.com/watch?v=hJrbKaL_eH4,3941,0
Ripe Stories,NRpBQI7y3q0,r/MaliciousCompliance HOA Officers Invaded My Home Over Pressure Washing.. Instant Arrest Ensues!,2026-03-04,Mar 04,https://youtube.com/watch?v=NRpBQI7y3q0,31162,0
Lost Genre,lo-UG5P3jWw,Single Mom Friend Is Furious I Won’t Watch Her Kids All the Time… Now I ‘Suck’ as a Friend,2026-03-04,Mar 04,https://youtube.com/watch?v=lo-UG5P3jWw,29782,0
rSlash,tST6xHuqI_o,r/AITA Mom Demands All My Money,2026-03-03,Mar 03,https://youtube.com/watch?v=tST6xHuqI_o,114315,0
Comfort Level,Nf_u3ZC4H5E,GF Thinks Cooking Is Optional—I Disagree + BF Wants to Claim My Mortgage🍳🤷‍♂️(Reddit Stories) Ep.225,2026-03-03,Mar 03,https://youtube.com/watch?v=Nf_u3ZC4H5E,47314,0
Charlotte Dobre,ZH26oIwvJ_8,i crashed my ex's wedding after she cheated on me... with my COUSIN - Charlotte Dobre REACTION,2026-03-03,Mar 03,https://youtube.com/watch?v=ZH26oIwvJ_8,630699,0
Updoot Studios,nlvu_CR1chU,What Is Too Much Over Sharing On Social Media?,2026-03-03,Mar 03,https://youtube.com/watch?v=nlvu_CR1chU,8021,0
rSpace,R7NXE2wdir8,Religious Wife Cheated With a Guy From Instagram — I Exposed the Truth to Her Entire Church,2026-03-03,Mar 03,https://youtube.com/watch?v=R7NXE2wdir8,13536,0
rSpace,8DOC6amN8uA,"My Wife Called Another Man’s Name in Bed, Exposing Her Affair...",2026-03-03,Mar 03,https://youtube.com/watch?v=8DOC6amN8uA,12613,0
Ripe Stories,2HuscTygRHk,"Neighbor Uses Chainsaw To Cut My Fence, Claims Half My Ranch Belongs To Her!",2026-03-03,Mar 03,https://youtube.com/watch?v=2HuscTygRHk,23671,0
Lost Genre,u4zZogjMf7Y,Friend Is Furious I Called Out Her Cheating Husband…And Was Totally Right About It,2026-03-03,Mar 03,https://youtube.com/watch?v=u4zZogjMf7Y,30933,0
rSlash,ADfSbDOsvLI,r/Askreddit What's the Dumbest Idea that Actually Worked?,2026-03-02,Mar 02,https://youtube.com/watch?v=ADfSbDOsvLI,112685,0
MrBallen,9HWssrnzfk4,BYU coed murder took 25 years to solve...,2026-03-02,Mar 02,https://youtube.com/watch?v=9HWssrnzfk4,1177424,0
Reddit On Wiki,sZBkp5jWAFA,I RATED My Wife's Massage A 7/10 And Now She's MAD! | Reading Reddit Stories,2026-03-02,Mar 02,https://youtube.com/watch?v=sZBkp5jWAFA,14630,0
Mr. Redder,KCZYnl16axo,My Parents Demand I Watch the Super Bowl… HUGE MISTAKE! | Entitled Family Stories,2026-03-02,Mar 02,https://youtube.com/watch?v=KCZYnl16axo,13182,0
Updoot Studios,yWyYTwNWUNs,What Is the Best Witty Comeback You've Ever Witnessed?,2026-03-02,Mar 02,https://youtube.com/watch?v=yWyYTwNWUNs,4063,0
rSpace,yTLUkNM9WSg,My Girlfriend Slept With a Drug Dealer to Get Free Marijuana...,2026-03-02,Mar 02,https://youtube.com/watch?v=yTLUkNM9WSg,11223,0
Ripe Stories,cKTrLSS4dJw,r/Maliciouscompliance Cut the IT Team in Half? I’ll Outsource Your Entire Department!,2026-03-02,Mar 02,https://youtube.com/watch?v=cKTrLSS4dJw,36570,0
Lost Genre,QoSLAcHY48k,My Best Friend’s Girlfriend Is Jealous of Mine—And She’s Ruining My Business - Reddit Stories,2026-03-02,Mar 02,https://youtube.com/watch?v=QoSLAcHY48k,35110,0
rSlash,CeLPg-O6cjw,r/Bestof My Uncle is Attracted to My Sister,2026-03-01,Mar 01,https://youtube.com/watch?v=CeLPg-O6cjw,149603,0
Updoot Studios,Kc5ulPSR5VE,What Body Language Always Proves To Be True?,2026-03-01,Mar 01,https://youtube.com/watch?v=Kc5ulPSR5VE,3702,0
Ripe Stories,cv-T3ihgYm8,HOA Karen Destroyed My New Dodge Charger SRT Hellcat So I Made Her Regret It Instantly!,2026-03-01,Mar 01,https://youtube.com/watch?v=cv-T3ihgYm8,28349,0
Lost Genre,vVtVUHwib_o,Cousin Hates My Success And Bullies Me Then Played Victim When I Called Her Out,2026-03-01,Mar 01,https://youtube.com/watch?v=vVtVUHwib_o,31563,0
rSlash,53EgK7daLcU,r/Nuclearrevenge Grandpa Fed a Guy to Gators,2026-02-28,Feb 28,https://youtube.com/watch?v=53EgK7daLcU,118869,0
Updoot Studios,xXI1vqgV9qU,What Are the Best Rumors You've Heard About Yourself?,2026-02-28,Feb 28,https://youtube.com/watch?v=xXI1vqgV9qU,3850,0
Ripe Stories,yhTSGgt7Y6M,"r/MaliciousCompliance - Karen Boss Threatens ""WORTHLESS"" Employee.. Gets HUMBLED!",2026-02-28,Feb 28,https://youtube.com/watch?v=yhTSGgt7Y6M,24876,0
Lost Genre,mW2jsUdOuh4,My Best Friend Ghosted Me for Getting Pregnant During Her ‘Wedding Year’,2026-02-28,Feb 28,https://youtube.com/watch?v=mW2jsUdOuh4,15958,0
rSlash,PjfSW3cFQKk,r/Bestof I Found My Teacher on Xbox Chat,2026-02-27,Feb 27,https://youtube.com/watch?v=PjfSW3cFQKk,131282,0
Reddit On Wiki,_K6oV5JAnGs,I REVEALED My Husband's TRUE Feelings About His Mom's Spaghetti... AITA?,2026-02-27,Feb 27,https://youtube.com/watch?v=_K6oV5JAnGs,15534,0
Updoot Studios,fJ4wgGxEgSs,When Did You Realize You're Actually the Bad Guy?,2026-02-27,Feb 27,https://youtube.com/watch?v=fJ4wgGxEgSs,6424,0
Karma Stories,dZM7VHb8PIg,r/BestOfReddit - She Chose LIKES Over LOVE and Ruined Everything!,2026-02-27,Feb 27,https://youtube.com/watch?v=dZM7VHb8PIg,5712,0
rSpace,SfbwVLu7lcE,Delusional and Insecure Wife Cheated Because She Thought I Had Cheated on Her;,2026-02-27,Feb 27,https://youtube.com/watch?v=SfbwVLu7lcE,11195,0
Ripe Stories,Oj8qAnwmwEM,Narcissistic Parents Abandoned Me at 18.. After 32 Years They Return & Want Money!,2026-02-27,Feb 27,https://youtube.com/watch?v=Oj8qAnwmwEM,22982,0
Lost Genre,PlcNfdMII9s,Coworker Grabbed My Girlfriend’s Arm and Called Me Abusive—Then He Reports Me To HR,2026-02-27,Feb 27,https://youtube.com/watch?v=PlcNfdMII9s,31127,0
Two Hot Takes,Z-JQ4djueA0,Odd Layers.. ft. The Basement Yard || Reddit Stories || Two Hot Takes Podcast,2026-02-26,Feb 26,https://youtube.com/watch?v=Z-JQ4djueA0,620716,0
rSlash,GnKe8skcjqc,r/AITA My Family Chose My Cheating Ex Over Me,2026-02-26,Feb 26,https://youtube.com/watch?v=GnKe8skcjqc,130538,0
Charlotte Dobre,Lcy41pRPNoA,my parents are uninvited to my wedding and I couldn't be HAPPIER - Charlotte Dobre REACTION,2026-02-26,Feb 26,https://youtube.com/watch?v=Lcy41pRPNoA,732573,0
Updoot Studios,UHJrl8svNVg,What's the Funniest Military Punishment You've Seen?,2026-02-26,Feb 26,https://youtube.com/watch?v=UHJrl8svNVg,5281,0
rSpace,rT5WE3FRdiM,Bailing My Wife Out of Jail Revealed Her Affair; I Ensured That Her Charges Ruined Her Life,2026-02-26,Feb 26,https://youtube.com/watch?v=rT5WE3FRdiM,12747,0
Ripe Stories,Uq8lngDHURM,r/AITA I Shot the HOA President,2026-02-26,Feb 26,https://youtube.com/watch?v=Uq8lngDHURM,31003,0
Lost Genre,QB9kG_QkmDU,My Sister Married My Creepy Ex… And I Don’t Trust Him Around My Teenage Daughter,2026-02-26,Feb 26,https://youtube.com/watch?v=QB9kG_QkmDU,27685,0
rSpace,SIJz68Wdu44,My Wife Tried to Blame Me for Her Affair—So I Exposed the Truth to Our Entire Town,2026-02-25,Feb 25,https://youtube.com/watch?v=SIJz68Wdu44,13770,0
Karma Stories,Yk4QQj55LT8,"r/MaliciousCompliance - NO Title, NO Power. But I RUN The Show!",2026-02-24,Feb 24,https://youtube.com/watch?v=Yk4QQj55LT8,7209,0
rSpace,P3bvBBLR4YQ,One Late-Night Text Exposed My Pregnant Wife—Now She’s Raising Her AP’s Baby Alone,2026-02-24,Feb 24,https://youtube.com/watch?v=P3bvBBLR4YQ,15629,0
Reddit On Wiki,ils2fyfz-vg,My Boyfriend DEMANDS I Follow His Bedtime Rules! | Reddit Reading Stories,2026-02-23,Feb 23,https://youtube.com/watch?v=ils2fyfz-vg,14643,0
Mr. Redder,LGUaLwInTeE,My Husband's Mom GOT ME FIRED... Now I'm Suing Her! | Entitled Family Stories,2026-02-23,Feb 23,https://youtube.com/watch?v=LGUaLwInTeE,15282,0
